{
  "schema_version": 1,
  "id": "HANDOFF-0001",
  "task_id": "TASK-0001",
  "stage_id": "STAGE-0001",
  "work_order_id": "WORK-0001",
  "kind": "working",
  "based_on_checkpoint_id": "CHECKPOINT-0001",
  "completed": ["Created pyproject.toml and CLI"],
  "remaining": ["Write tests"],
  "unverified": [],
  "changed_files": ["pyproject.toml", "src/continuity/cli.py"],
  "checks": [{"id": "PYTHON_VERSION", "exit_code": 0, "status": "pass"}],
  "risks": [],
  "next_action": "Run unit tests",
  "source_fingerprint": {
    "git_head": "abc123",
    "staged_diff_sha256": null,
    "unstaged_diff_sha256": null,
    "untracked_files": [],
    "captured_at": "2026-07-17T15:00:00+08:00"
  },
  "created_at": "2026-07-17T15:00:00+08:00"
}
